[
  {
    "run_id": "pilot20_run",
    "patient_id": "BraTS2021_00003",
    "model": "swinunetr",
    "status": "complete",
    "code_commit": "5cbc5cc614e09482149b4304ee2060c6a838f783",
    "manifest_sha256": "8c6da29de2ac840fdfd27d03794e19e3cf093cd666addc9561a466a0eb139c69",
    "checkpoint_sha256": {
      "swinunetr": "6fd4ec5dc690f365a99c10b92f0d5519ca8a6b68feb844ff3424e9f6a01f6a39"
    },
    "settings": {
      "sliding_window_roi": [
        96,
        96,
        96
      ],
      "input_channel_order": [
        "FLAIR",
        "T1c",
        "T1",
        "T2"
      ],
      "ensemble_settings": null
    },
    "metrics": {
      "WT": {
        "tp": 97469,
        "fp": 1466,
        "fn": 1770,
        "precision": 0.9852,
        "dice": 0.9837,
        "sensitivity": 0.9822,
        "pred_volume_ml": 98.935,
        "gt_volume_ml": 99.239,
        "abs_volume_error_ml": 0.304,
        "rel_volume_error_pct": 0.3
      },
      "TC": {
        "tp": 40910,
        "fp": 1216,
        "fn": 556,
        "precision": 0.9711,
        "dice": 0.9788,
        "sensitivity": 0.9866,
        "pred_volume_ml": 42.126,
        "gt_volume_ml": 41.466,
        "abs_volume_error_ml": 0.66,
        "rel_volume_error_pct": 1.6
      },
      "ET": {
        "tp": 23552,
        "fp": 2094,
        "fn": 700,
        "precision": 0.9183,
        "dice": 0.944,
        "sensitivity": 0.9711,
        "pred_volume_ml": 25.646,
        "gt_volume_ml": 24.252,
        "abs_volume_error_ml": 1.394,
        "rel_volume_error_pct": 5.7
      }
    },
    "runtime_seconds": 10.64,
    "peak_gpu_memory_bytes": null
  },
  {
    "run_id": "pilot20_run",
    "patient_id": "BraTS2021_00025",
    "model": "swinunetr",
    "status": "complete",
    "code_commit": "5cbc5cc614e09482149b4304ee2060c6a838f783",
    "manifest_sha256": "8c6da29de2ac840fdfd27d03794e19e3cf093cd666addc9561a466a0eb139c69",
    "checkpoint_sha256": {
      "swinunetr": "6fd4ec5dc690f365a99c10b92f0d5519ca8a6b68feb844ff3424e9f6a01f6a39"
    },
    "settings": {
      "sliding_window_roi": [
        96,
        96,
        96
      ],
      "input_channel_order": [
        "FLAIR",
        "T1c",
        "T1",
        "T2"
      ],
      "ensemble_settings": null
    },
    "metrics": {
      "WT": {
        "tp": 21672,
        "fp": 233,
        "fn": 8885,
        "precision": 0.9894,
        "dice": 0.8262,
        "sensitivity": 0.7092,
        "pred_volume_ml": 21.905,
        "gt_volume_ml": 30.557,
        "abs_volume_error_ml": 8.652,
        "rel_volume_error_pct": 28.3
      },
      "TC": {
        "tp": 4436,
        "fp": 160,
        "fn": 1010,
        "precision": 0.9652,
        "dice": 0.8835,
        "sensitivity": 0.8145,
        "pred_volume_ml": 4.596,
        "gt_volume_ml": 5.446,
        "abs_volume_error_ml": 0.85,
        "rel_volume_error_pct": 15.6
      },
      "ET": {
        "tp": 3986,
        "fp": 377,
        "fn": 1164,
        "precision": 0.9136,
        "dice": 0.838,
        "sensitivity": 0.774,
        "pred_volume_ml": 4.363,
        "gt_volume_ml": 5.15,
        "abs_volume_error_ml": 0.787,
        "rel_volume_error_pct": 15.3
      }
    },
    "runtime_seconds": 10.02,
    "peak_gpu_memory_bytes": null
  },
  {
    "run_id": "pilot20_run",
    "patient_id": "BraTS2021_00658",
    "model": "swinunetr",
    "status": "complete",
    "code_commit": "5cbc5cc614e09482149b4304ee2060c6a838f783",
    "manifest_sha256": "8c6da29de2ac840fdfd27d03794e19e3cf093cd666addc9561a466a0eb139c69",
    "checkpoint_sha256": {
      "swinunetr": "6fd4ec5dc690f365a99c10b92f0d5519ca8a6b68feb844ff3424e9f6a01f6a39"
    },
    "settings": {
      "sliding_window_roi": [
        96,
        96,
        96
      ],
      "input_channel_order": [
        "FLAIR",
        "T1c",
        "T1",
        "T2"
      ],
      "ensemble_settings": null
    },
    "metrics": {
      "WT": {
        "tp": 67748,
        "fp": 2553,
        "fn": 3813,
        "precision": 0.9637,
        "dice": 0.9551,
        "sensitivity": 0.9467,
        "pred_volume_ml": 70.301,
        "gt_volume_ml": 71.561,
        "abs_volume_error_ml": 1.26,
        "rel_volume_error_pct": 1.8
      },
      "TC": {
        "tp": 39873,
        "fp": 767,
        "fn": 1556,
        "precision": 0.9811,
        "dice": 0.9717,
        "sensitivity": 0.9624,
        "pred_volume_ml": 40.64,
        "gt_volume_ml": 41.429,
        "abs_volume_error_ml": 0.789,
        "rel_volume_error_pct": 1.9
      },
      "ET": {
        "tp": 21775,
        "fp": 1502,
        "fn": 2830,
        "precision": 0.9355,
        "dice": 0.9095,
        "sensitivity": 0.885,
        "pred_volume_ml": 23.277,
        "gt_volume_ml": 24.605,
        "abs_volume_error_ml": 1.328,
        "rel_volume_error_pct": 5.4
      }
    },
    "runtime_seconds": 10.33,
    "peak_gpu_memory_bytes": null
  },
  {
    "run_id": "pilot20_run",
    "patient_id": "BraTS2021_00733",
    "model": "swinunetr",
    "status": "complete",
    "code_commit": "5cbc5cc614e09482149b4304ee2060c6a838f783",
    "manifest_sha256": "8c6da29de2ac840fdfd27d03794e19e3cf093cd666addc9561a466a0eb139c69",
    "checkpoint_sha256": {
      "swinunetr": "6fd4ec5dc690f365a99c10b92f0d5519ca8a6b68feb844ff3424e9f6a01f6a39"
    },
    "settings": {
      "sliding_window_roi": [
        96,
        96,
        96
      ],
      "input_channel_order": [
        "FLAIR",
        "T1c",
        "T1",
        "T2"
      ],
      "ensemble_settings": null
    },
    "metrics": {
      "WT": {
        "tp": 79732,
        "fp": 3150,
        "fn": 2081,
        "precision": 0.962,
        "dice": 0.9682,
        "sensitivity": 0.9746,
        "pred_volume_ml": 82.882,
        "gt_volume_ml": 81.813,
        "abs_volume_error_ml": 1.069,
        "rel_volume_error_pct": 1.3
      },
      "TC": {
        "tp": 36827,
        "fp": 559,
        "fn": 764,
        "precision": 0.985,
        "dice": 0.9824,
        "sensitivity": 0.9797,
        "pred_volume_ml": 37.386,
        "gt_volume_ml": 37.591,
        "abs_volume_error_ml": 0.205,
        "rel_volume_error_pct": 0.5
      },
      "ET": {
        "tp": 19643,
        "fp": 1291,
        "fn": 1003,
        "precision": 0.9383,
        "dice": 0.9448,
        "sensitivity": 0.9514,
        "pred_volume_ml": 20.934,
        "gt_volume_ml": 20.646,
        "abs_volume_error_ml": 0.288,
        "rel_volume_error_pct": 1.4
      }
    },
    "runtime_seconds": 8.34,
    "peak_gpu_memory_bytes": null
  },
  {
    "run_id": "pilot20_run",
    "patient_id": "BraTS2021_00529",
    "model": "swinunetr",
    "status": "complete",
    "code_commit": "5cbc5cc614e09482149b4304ee2060c6a838f783",
    "manifest_sha256": "8c6da29de2ac840fdfd27d03794e19e3cf093cd666addc9561a466a0eb139c69",
    "checkpoint_sha256": {
      "swinunetr": "6fd4ec5dc690f365a99c10b92f0d5519ca8a6b68feb844ff3424e9f6a01f6a39"
    },
    "settings": {
      "sliding_window_roi": [
        96,
        96,
        96
      ],
      "input_channel_order": [
        "FLAIR",
        "T1c",
        "T1",
        "T2"
      ],
      "ensemble_settings": null
    },
    "metrics": {
      "WT": {
        "tp": 45641,
        "fp": 1965,
        "fn": 9501,
        "precision": 0.9587,
        "dice": 0.8884,
        "sensitivity": 0.8277,
        "pred_volume_ml": 47.606,
        "gt_volume_ml": 55.142,
        "abs_volume_error_ml": 7.536,
        "rel_volume_error_pct": 13.7
      },
      "TC": {
        "tp": 15767,
        "fp": 459,
        "fn": 6344,
        "precision": 0.9717,
        "dice": 0.8225,
        "sensitivity": 0.7131,
        "pred_volume_ml": 16.226,
        "gt_volume_ml": 22.111,
        "abs_volume_error_ml": 5.885,
        "rel_volume_error_pct": 26.6
      },
      "ET": {
        "tp": 8490,
        "fp": 672,
        "fn": 4616,
        "precision": 0.9267,
        "dice": 0.7625,
        "sensitivity": 0.6478,
        "pred_volume_ml": 9.162,
        "gt_volume_ml": 13.106,
        "abs_volume_error_ml": 3.944,
        "rel_volume_error_pct": 30.1
      }
    },
    "runtime_seconds": 9.5,
    "peak_gpu_memory_bytes": null
  },
  {
    "run_id": "pilot20_run",
    "patient_id": "BraTS2021_00096",
    "model": "swinunetr",
    "status": "complete",
    "code_commit": "5cbc5cc614e09482149b4304ee2060c6a838f783",
    "manifest_sha256": "8c6da29de2ac840fdfd27d03794e19e3cf093cd666addc9561a466a0eb139c69",
    "checkpoint_sha256": {
      "swinunetr": "6fd4ec5dc690f365a99c10b92f0d5519ca8a6b68feb844ff3424e9f6a01f6a39"
    },
    "settings": {
      "sliding_window_roi": [
        96,
        96,
        96
      ],
      "input_channel_order": [
        "FLAIR",
        "T1c",
        "T1",
        "T2"
      ],
      "ensemble_settings": null
    },
    "metrics": {
      "WT": {
        "tp": 112517,
        "fp": 1663,
        "fn": 6798,
        "precision": 0.9854,
        "dice": 0.9638,
        "sensitivity": 0.943,
        "pred_volume_ml": 114.18,
        "gt_volume_ml": 119.315,
        "abs_volume_error_ml": 5.135,
        "rel_volume_error_pct": 4.3
      },
      "TC": {
        "tp": 24571,
        "fp": 582,
        "fn": 245,
        "precision": 0.9769,
        "dice": 0.9834,
        "sensitivity": 0.9901,
        "pred_volume_ml": 25.153,
        "gt_volume_ml": 24.816,
        "abs_volume_error_ml": 0.337,
        "rel_volume_error_pct": 1.4
      },
      "ET": {
        "tp": 14538,
        "fp": 453,
        "fn": 619,
        "precision": 0.9698,
        "dice": 0.9644,
        "sensitivity": 0.9592,
        "pred_volume_ml": 14.991,
        "gt_volume_ml": 15.157,
        "abs_volume_error_ml": 0.166,
        "rel_volume_error_pct": 1.1
      }
    },
    "runtime_seconds": 9.59,
    "peak_gpu_memory_bytes": null
  },
  {
    "run_id": "pilot20_run",
    "patient_id": "BraTS2021_00774",
    "model": "swinunetr",
    "status": "complete",